{
  "schemaVersion": "0.1.0",
  "id": "starter.nose.bridge",
  "version": "1.0.0",
  "kind": "face",
  "display": {
    "name": "Defined Bridge",
    "tags": [
      "face",
      "nose"
    ],
    "thumbnail": "thumbnails/nose-bridge.png"
  },
  "compatibility": {
    "rigFamilies": [
      "starter-humanoid@1"
    ],
    "engine": ">=0.1.0 <1.0.0",
    "fitTags": [
      "body:shared-v1"
    ]
  },
  "equip": {
    "slots": [
      "nose"
    ],
    "exclusiveGroup": "nose",
    "requires": [
      "appearance:head"
    ],
    "conflicts": [],
    "provides": [
      "appearance:nose",
      "mirror.safe"
    ]
  },
  "palette": {
    "roles": {
      "skin.shadow": {
        "default": "#7A3D46",
        "mode": "replace"
      }
    }
  },
  "effects": [],
  "fragments": [
    {
      "id": "full-body-back-any",
      "selector": {
        "profile": "full-body",
        "view": "back",
        "expression": "*"
      },
      "source": "images/nose-bridge/full-body-back-any.png",
      "plane": "face-features",
      "order": 0,
      "anchor": "canvas.origin",
      "pivot": [
        0,
        0
      ],
      "paletteRoles": [
        "skin.shadow"
      ],
      "covers": [],
      "suppresses": [],
      "tags": [
        "asset.nose-bridge"
      ],
      "bounds": {
        "x": 0,
        "y": 0,
        "width": 256,
        "height": 384
      }
    },
    {
      "id": "full-body-front-any",
      "selector": {
        "profile": "full-body",
        "view": "front",
        "expression": "*"
      },
      "source": "images/nose-bridge/full-body-front-any.png",
      "plane": "face-features",
      "order": 0,
      "anchor": "canvas.origin",
      "pivot": [
        0,
        0
      ],
      "paletteRoles": [
        "skin.shadow"
      ],
      "covers": [],
      "suppresses": [],
      "tags": [
        "asset.nose-bridge"
      ],
      "bounds": {
        "x": 0,
        "y": 0,
        "width": 256,
        "height": 384
      }
    },
    {
      "id": "full-body-left-any",
      "selector": {
        "profile": "full-body",
        "view": "left",
        "expression": "*"
      },
      "source": "images/nose-bridge/full-body-left-any.png",
      "plane": "face-features",
      "order": 0,
      "anchor": "canvas.origin",
      "pivot": [
        0,
        0
      ],
      "paletteRoles": [
        "skin.shadow"
      ],
      "covers": [],
      "suppresses": [],
      "tags": [
        "asset.nose-bridge"
      ],
      "bounds": {
        "x": 0,
        "y": 0,
        "width": 256,
        "height": 384
      }
    },
    {
      "id": "full-body-right-any",
      "selector": {
        "profile": "full-body",
        "view": "right",
        "expression": "*"
      },
      "source": "images/nose-bridge/full-body-right-any.png",
      "plane": "face-features",
      "order": 0,
      "anchor": "canvas.origin",
      "pivot": [
        0,
        0
      ],
      "paletteRoles": [
        "skin.shadow"
      ],
      "covers": [],
      "suppresses": [],
      "tags": [
        "asset.nose-bridge"
      ],
      "bounds": {
        "x": 0,
        "y": 0,
        "width": 256,
        "height": 384
      }
    },
    {
      "id": "portrait-front-any",
      "selector": {
        "profile": "portrait",
        "view": "front",
        "expression": "*"
      },
      "source": "images/nose-bridge/portrait-front-any.png",
      "plane": "face-features",
      "order": 0,
      "anchor": "canvas.origin",
      "pivot": [
        0,
        0
      ],
      "paletteRoles": [
        "skin.shadow"
      ],
      "covers": [],
      "suppresses": [],
      "tags": [
        "asset.nose-bridge"
      ],
      "bounds": {
        "x": 0,
        "y": 0,
        "width": 256,
        "height": 256
      }
    },
    {
      "id": "sprite-back",
      "selector": {
        "profile": "sprite",
        "view": "back"
      },
      "source": "images/nose-bridge/sprite-back.png",
      "plane": "face-features",
      "order": 0,
      "anchor": "canvas.origin",
      "pivot": [
        0,
        0
      ],
      "paletteRoles": [
        "skin.shadow"
      ],
      "covers": [],
      "suppresses": [],
      "tags": [
        "asset.nose-bridge"
      ],
      "bounds": {
        "x": 0,
        "y": 0,
        "width": 96,
        "height": 96
      }
    },
    {
      "id": "sprite-front",
      "selector": {
        "profile": "sprite",
        "view": "front"
      },
      "source": "images/nose-bridge/sprite-front.png",
      "plane": "face-features",
      "order": 0,
      "anchor": "canvas.origin",
      "pivot": [
        0,
        0
      ],
      "paletteRoles": [
        "skin.shadow"
      ],
      "covers": [],
      "suppresses": [],
      "tags": [
        "asset.nose-bridge"
      ],
      "bounds": {
        "x": 0,
        "y": 0,
        "width": 96,
        "height": 96
      }
    },
    {
      "id": "sprite-left",
      "selector": {
        "profile": "sprite",
        "view": "left"
      },
      "source": "images/nose-bridge/sprite-left.png",
      "plane": "face-features",
      "order": 0,
      "anchor": "canvas.origin",
      "pivot": [
        0,
        0
      ],
      "paletteRoles": [
        "skin.shadow"
      ],
      "covers": [],
      "suppresses": [],
      "tags": [
        "asset.nose-bridge"
      ],
      "bounds": {
        "x": 0,
        "y": 0,
        "width": 96,
        "height": 96
      }
    },
    {
      "id": "sprite-right",
      "selector": {
        "profile": "sprite",
        "view": "right"
      },
      "source": "images/nose-bridge/sprite-right.png",
      "plane": "face-features",
      "order": 0,
      "anchor": "canvas.origin",
      "pivot": [
        0,
        0
      ],
      "paletteRoles": [
        "skin.shadow"
      ],
      "covers": [],
      "suppresses": [],
      "tags": [
        "asset.nose-bridge"
      ],
      "bounds": {
        "x": 0,
        "y": 0,
        "width": 96,
        "height": 96
      }
    }
  ],
  "fallbacks": [],
  "provenance": {
    "authors": [
      "Character Creator contributors"
    ],
    "license": "CC0-1.0",
    "source": null,
    "contentHash": "sha256-6ca5d83bea3b5b9bf6913e03489094829b3d065c884fca8c94bf782f03a39ca6"
  }
}
