{
  "schemaVersion": "0.1.0",
  "id": "starter.top.fitted-shirt",
  "version": "1.0.0",
  "kind": "top",
  "display": {
    "name": "Fitted Shirt",
    "tags": [
      "clothing",
      "fitted",
      "recolorable"
    ],
    "thumbnail": "thumbnails/top-fitted-shirt.png"
  },
  "compatibility": {
    "rigFamilies": [
      "starter-humanoid@1"
    ],
    "engine": ">=0.1.0 <1.0.0",
    "fitTags": [
      "body:shared-v1"
    ]
  },
  "equip": {
    "slots": [
      "top"
    ],
    "exclusiveGroup": "top",
    "requires": [],
    "conflicts": [],
    "provides": [
      "appearance:top",
      "mirror.safe"
    ]
  },
  "palette": {
    "roles": {
      "garment.primary": {
        "default": "#4ED7E8",
        "mode": "replace"
      }
    }
  },
  "effects": [],
  "fragments": [
    {
      "id": "full-body-back-any",
      "selector": {
        "profile": "full-body",
        "view": "back",
        "expression": "*"
      },
      "source": "images/top-fitted-shirt/full-body-back-any.png",
      "plane": "garment-main",
      "order": 0,
      "anchor": "canvas.origin",
      "pivot": [
        0,
        0
      ],
      "paletteRoles": [
        "garment.primary"
      ],
      "covers": [],
      "suppresses": [],
      "tags": [
        "asset.top-fitted-shirt"
      ],
      "bounds": {
        "x": 0,
        "y": 0,
        "width": 256,
        "height": 384
      }
    },
    {
      "id": "full-body-front-any",
      "selector": {
        "profile": "full-body",
        "view": "front",
        "expression": "*"
      },
      "source": "images/top-fitted-shirt/full-body-front-any.png",
      "plane": "garment-main",
      "order": 0,
      "anchor": "canvas.origin",
      "pivot": [
        0,
        0
      ],
      "paletteRoles": [
        "garment.primary"
      ],
      "covers": [],
      "suppresses": [],
      "tags": [
        "asset.top-fitted-shirt"
      ],
      "bounds": {
        "x": 0,
        "y": 0,
        "width": 256,
        "height": 384
      }
    },
    {
      "id": "full-body-left-any",
      "selector": {
        "profile": "full-body",
        "view": "left",
        "expression": "*"
      },
      "source": "images/top-fitted-shirt/full-body-left-any.png",
      "plane": "garment-main",
      "order": 0,
      "anchor": "canvas.origin",
      "pivot": [
        0,
        0
      ],
      "paletteRoles": [
        "garment.primary"
      ],
      "covers": [],
      "suppresses": [],
      "tags": [
        "asset.top-fitted-shirt"
      ],
      "bounds": {
        "x": 0,
        "y": 0,
        "width": 256,
        "height": 384
      }
    },
    {
      "id": "full-body-right-any",
      "selector": {
        "profile": "full-body",
        "view": "right",
        "expression": "*"
      },
      "source": "images/top-fitted-shirt/full-body-right-any.png",
      "plane": "garment-main",
      "order": 0,
      "anchor": "canvas.origin",
      "pivot": [
        0,
        0
      ],
      "paletteRoles": [
        "garment.primary"
      ],
      "covers": [],
      "suppresses": [],
      "tags": [
        "asset.top-fitted-shirt"
      ],
      "bounds": {
        "x": 0,
        "y": 0,
        "width": 256,
        "height": 384
      }
    },
    {
      "id": "portrait-front-any",
      "selector": {
        "profile": "portrait",
        "view": "front",
        "expression": "*"
      },
      "source": "images/top-fitted-shirt/portrait-front-any.png",
      "plane": "garment-main",
      "order": 0,
      "anchor": "canvas.origin",
      "pivot": [
        0,
        0
      ],
      "paletteRoles": [
        "garment.primary"
      ],
      "covers": [],
      "suppresses": [],
      "tags": [
        "asset.top-fitted-shirt"
      ],
      "bounds": {
        "x": 0,
        "y": 0,
        "width": 256,
        "height": 256
      }
    },
    {
      "id": "sprite-back",
      "selector": {
        "profile": "sprite",
        "view": "back"
      },
      "source": "images/top-fitted-shirt/sprite-back.png",
      "plane": "garment-main",
      "order": 0,
      "anchor": "canvas.origin",
      "pivot": [
        0,
        0
      ],
      "paletteRoles": [
        "garment.primary"
      ],
      "covers": [],
      "suppresses": [],
      "tags": [
        "asset.top-fitted-shirt"
      ],
      "bounds": {
        "x": 0,
        "y": 0,
        "width": 96,
        "height": 96
      }
    },
    {
      "id": "sprite-front",
      "selector": {
        "profile": "sprite",
        "view": "front"
      },
      "source": "images/top-fitted-shirt/sprite-front.png",
      "plane": "garment-main",
      "order": 0,
      "anchor": "canvas.origin",
      "pivot": [
        0,
        0
      ],
      "paletteRoles": [
        "garment.primary"
      ],
      "covers": [],
      "suppresses": [],
      "tags": [
        "asset.top-fitted-shirt"
      ],
      "bounds": {
        "x": 0,
        "y": 0,
        "width": 96,
        "height": 96
      }
    },
    {
      "id": "sprite-left",
      "selector": {
        "profile": "sprite",
        "view": "left"
      },
      "source": "images/top-fitted-shirt/sprite-left.png",
      "plane": "garment-main",
      "order": 0,
      "anchor": "canvas.origin",
      "pivot": [
        0,
        0
      ],
      "paletteRoles": [
        "garment.primary"
      ],
      "covers": [],
      "suppresses": [],
      "tags": [
        "asset.top-fitted-shirt"
      ],
      "bounds": {
        "x": 0,
        "y": 0,
        "width": 96,
        "height": 96
      }
    },
    {
      "id": "sprite-right",
      "selector": {
        "profile": "sprite",
        "view": "right"
      },
      "source": "images/top-fitted-shirt/sprite-right.png",
      "plane": "garment-main",
      "order": 0,
      "anchor": "canvas.origin",
      "pivot": [
        0,
        0
      ],
      "paletteRoles": [
        "garment.primary"
      ],
      "covers": [],
      "suppresses": [],
      "tags": [
        "asset.top-fitted-shirt"
      ],
      "bounds": {
        "x": 0,
        "y": 0,
        "width": 96,
        "height": 96
      }
    }
  ],
  "fallbacks": [],
  "provenance": {
    "authors": [
      "Character Creator contributors"
    ],
    "license": "CC0-1.0",
    "source": null,
    "contentHash": "sha256-fb376b4acb9f19b201856bab9eefd85edaf5c866a1923356bec0fc7cdbe21ad9"
  }
}
