{
  "schemaVersion": "0.1.0",
  "id": "starter.accessory.brim-hat",
  "version": "1.0.0",
  "kind": "accessory",
  "display": {
    "name": "Archivist Hat",
    "tags": [
      "accessory",
      "hat",
      "suppression"
    ],
    "thumbnail": "thumbnails/accessory-brim-hat.png"
  },
  "compatibility": {
    "rigFamilies": [
      "starter-humanoid@1"
    ],
    "engine": ">=0.1.0 <1.0.0",
    "fitTags": [
      "body:shared-v1"
    ]
  },
  "equip": {
    "slots": [
      "hat"
    ],
    "exclusiveGroup": "hat",
    "requires": [
      "appearance:hair"
    ],
    "conflicts": [],
    "provides": [
      "appearance:hat",
      "mirror.safe"
    ]
  },
  "palette": {
    "roles": {
      "accent.base": {
        "default": "#54314D",
        "mode": "replace"
      }
    }
  },
  "effects": [
    {
      "kind": "suppress-tags",
      "targetTags": [
        "hair.crown"
      ]
    }
  ],
  "fragments": [
    {
      "id": "full-body-back-any",
      "selector": {
        "profile": "full-body",
        "view": "back",
        "expression": "*"
      },
      "source": "images/accessory-brim-hat/full-body-back-any.png",
      "plane": "accessory-front",
      "order": 0,
      "anchor": "canvas.origin",
      "pivot": [
        0,
        0
      ],
      "paletteRoles": [
        "accent.base"
      ],
      "covers": [],
      "suppresses": [],
      "tags": [
        "asset.accessory-brim-hat"
      ],
      "bounds": {
        "x": 0,
        "y": 0,
        "width": 256,
        "height": 384
      }
    },
    {
      "id": "full-body-front-any",
      "selector": {
        "profile": "full-body",
        "view": "front",
        "expression": "*"
      },
      "source": "images/accessory-brim-hat/full-body-front-any.png",
      "plane": "accessory-front",
      "order": 0,
      "anchor": "canvas.origin",
      "pivot": [
        0,
        0
      ],
      "paletteRoles": [
        "accent.base"
      ],
      "covers": [],
      "suppresses": [],
      "tags": [
        "asset.accessory-brim-hat"
      ],
      "bounds": {
        "x": 0,
        "y": 0,
        "width": 256,
        "height": 384
      }
    },
    {
      "id": "full-body-left-any",
      "selector": {
        "profile": "full-body",
        "view": "left",
        "expression": "*"
      },
      "source": "images/accessory-brim-hat/full-body-left-any.png",
      "plane": "accessory-front",
      "order": 0,
      "anchor": "canvas.origin",
      "pivot": [
        0,
        0
      ],
      "paletteRoles": [
        "accent.base"
      ],
      "covers": [],
      "suppresses": [],
      "tags": [
        "asset.accessory-brim-hat"
      ],
      "bounds": {
        "x": 0,
        "y": 0,
        "width": 256,
        "height": 384
      }
    },
    {
      "id": "full-body-right-any",
      "selector": {
        "profile": "full-body",
        "view": "right",
        "expression": "*"
      },
      "source": "images/accessory-brim-hat/full-body-right-any.png",
      "plane": "accessory-front",
      "order": 0,
      "anchor": "canvas.origin",
      "pivot": [
        0,
        0
      ],
      "paletteRoles": [
        "accent.base"
      ],
      "covers": [],
      "suppresses": [],
      "tags": [
        "asset.accessory-brim-hat"
      ],
      "bounds": {
        "x": 0,
        "y": 0,
        "width": 256,
        "height": 384
      }
    },
    {
      "id": "portrait-front-any",
      "selector": {
        "profile": "portrait",
        "view": "front",
        "expression": "*"
      },
      "source": "images/accessory-brim-hat/portrait-front-any.png",
      "plane": "accessory-front",
      "order": 0,
      "anchor": "canvas.origin",
      "pivot": [
        0,
        0
      ],
      "paletteRoles": [
        "accent.base"
      ],
      "covers": [],
      "suppresses": [],
      "tags": [
        "asset.accessory-brim-hat"
      ],
      "bounds": {
        "x": 0,
        "y": 0,
        "width": 256,
        "height": 256
      }
    },
    {
      "id": "sprite-back",
      "selector": {
        "profile": "sprite",
        "view": "back"
      },
      "source": "images/accessory-brim-hat/sprite-back.png",
      "plane": "accessory-front",
      "order": 0,
      "anchor": "canvas.origin",
      "pivot": [
        0,
        0
      ],
      "paletteRoles": [
        "accent.base"
      ],
      "covers": [],
      "suppresses": [],
      "tags": [
        "asset.accessory-brim-hat"
      ],
      "bounds": {
        "x": 0,
        "y": 0,
        "width": 96,
        "height": 96
      }
    },
    {
      "id": "sprite-front",
      "selector": {
        "profile": "sprite",
        "view": "front"
      },
      "source": "images/accessory-brim-hat/sprite-front.png",
      "plane": "accessory-front",
      "order": 0,
      "anchor": "canvas.origin",
      "pivot": [
        0,
        0
      ],
      "paletteRoles": [
        "accent.base"
      ],
      "covers": [],
      "suppresses": [],
      "tags": [
        "asset.accessory-brim-hat"
      ],
      "bounds": {
        "x": 0,
        "y": 0,
        "width": 96,
        "height": 96
      }
    },
    {
      "id": "sprite-left",
      "selector": {
        "profile": "sprite",
        "view": "left"
      },
      "source": "images/accessory-brim-hat/sprite-left.png",
      "plane": "accessory-front",
      "order": 0,
      "anchor": "canvas.origin",
      "pivot": [
        0,
        0
      ],
      "paletteRoles": [
        "accent.base"
      ],
      "covers": [],
      "suppresses": [],
      "tags": [
        "asset.accessory-brim-hat"
      ],
      "bounds": {
        "x": 0,
        "y": 0,
        "width": 96,
        "height": 96
      }
    },
    {
      "id": "sprite-right",
      "selector": {
        "profile": "sprite",
        "view": "right"
      },
      "source": "images/accessory-brim-hat/sprite-right.png",
      "plane": "accessory-front",
      "order": 0,
      "anchor": "canvas.origin",
      "pivot": [
        0,
        0
      ],
      "paletteRoles": [
        "accent.base"
      ],
      "covers": [],
      "suppresses": [],
      "tags": [
        "asset.accessory-brim-hat"
      ],
      "bounds": {
        "x": 0,
        "y": 0,
        "width": 96,
        "height": 96
      }
    }
  ],
  "fallbacks": [],
  "provenance": {
    "authors": [
      "Character Creator contributors"
    ],
    "license": "CC0-1.0",
    "source": null,
    "contentHash": "sha256-d99925d03603f5ee20f939a581e6d33f98cc353ac2a75ec360fc8f5eb9b504c8"
  }
}
