{
  "schemaVersion": "0.1.0",
  "id": "starter.outfit.simple",
  "version": "1.0.0",
  "kind": "outfit",
  "display": {
    "name": "Courier One-piece",
    "tags": [
      "clothing",
      "multi-slot",
      "one-piece"
    ],
    "thumbnail": "thumbnails/outfit-simple.png"
  },
  "compatibility": {
    "rigFamilies": [
      "starter-humanoid@1"
    ],
    "engine": ">=0.1.0 <1.0.0",
    "fitTags": [
      "body:shared-v1"
    ]
  },
  "equip": {
    "slots": [
      "bottom",
      "top"
    ],
    "exclusiveGroup": "top.bottom",
    "requires": [],
    "conflicts": [],
    "provides": [
      "appearance:bottom",
      "appearance:top",
      "mirror.safe"
    ]
  },
  "palette": {
    "roles": {
      "garment.primary": {
        "default": "#DD6E57",
        "mode": "replace"
      }
    }
  },
  "effects": [],
  "fragments": [
    {
      "id": "full-body-back-any",
      "selector": {
        "profile": "full-body",
        "view": "back",
        "expression": "*"
      },
      "source": "images/outfit-simple/full-body-back-any.png",
      "plane": "garment-main",
      "order": 0,
      "anchor": "canvas.origin",
      "pivot": [
        0,
        0
      ],
      "paletteRoles": [
        "garment.primary"
      ],
      "covers": [],
      "suppresses": [],
      "tags": [
        "asset.outfit-simple"
      ],
      "bounds": {
        "x": 0,
        "y": 0,
        "width": 256,
        "height": 384
      }
    },
    {
      "id": "full-body-front-any",
      "selector": {
        "profile": "full-body",
        "view": "front",
        "expression": "*"
      },
      "source": "images/outfit-simple/full-body-front-any.png",
      "plane": "garment-main",
      "order": 0,
      "anchor": "canvas.origin",
      "pivot": [
        0,
        0
      ],
      "paletteRoles": [
        "garment.primary"
      ],
      "covers": [],
      "suppresses": [],
      "tags": [
        "asset.outfit-simple"
      ],
      "bounds": {
        "x": 0,
        "y": 0,
        "width": 256,
        "height": 384
      }
    },
    {
      "id": "full-body-left-any",
      "selector": {
        "profile": "full-body",
        "view": "left",
        "expression": "*"
      },
      "source": "images/outfit-simple/full-body-left-any.png",
      "plane": "garment-main",
      "order": 0,
      "anchor": "canvas.origin",
      "pivot": [
        0,
        0
      ],
      "paletteRoles": [
        "garment.primary"
      ],
      "covers": [],
      "suppresses": [],
      "tags": [
        "asset.outfit-simple"
      ],
      "bounds": {
        "x": 0,
        "y": 0,
        "width": 256,
        "height": 384
      }
    },
    {
      "id": "full-body-right-any",
      "selector": {
        "profile": "full-body",
        "view": "right",
        "expression": "*"
      },
      "source": "images/outfit-simple/full-body-right-any.png",
      "plane": "garment-main",
      "order": 0,
      "anchor": "canvas.origin",
      "pivot": [
        0,
        0
      ],
      "paletteRoles": [
        "garment.primary"
      ],
      "covers": [],
      "suppresses": [],
      "tags": [
        "asset.outfit-simple"
      ],
      "bounds": {
        "x": 0,
        "y": 0,
        "width": 256,
        "height": 384
      }
    },
    {
      "id": "portrait-front-any",
      "selector": {
        "profile": "portrait",
        "view": "front",
        "expression": "*"
      },
      "source": "images/outfit-simple/portrait-front-any.png",
      "plane": "garment-main",
      "order": 0,
      "anchor": "canvas.origin",
      "pivot": [
        0,
        0
      ],
      "paletteRoles": [
        "garment.primary"
      ],
      "covers": [],
      "suppresses": [],
      "tags": [
        "asset.outfit-simple"
      ],
      "bounds": {
        "x": 0,
        "y": 0,
        "width": 256,
        "height": 256
      }
    },
    {
      "id": "sprite-back",
      "selector": {
        "profile": "sprite",
        "view": "back"
      },
      "source": "images/outfit-simple/sprite-back.png",
      "plane": "garment-main",
      "order": 0,
      "anchor": "canvas.origin",
      "pivot": [
        0,
        0
      ],
      "paletteRoles": [
        "garment.primary"
      ],
      "covers": [],
      "suppresses": [],
      "tags": [
        "asset.outfit-simple"
      ],
      "bounds": {
        "x": 0,
        "y": 0,
        "width": 96,
        "height": 96
      }
    },
    {
      "id": "sprite-front",
      "selector": {
        "profile": "sprite",
        "view": "front"
      },
      "source": "images/outfit-simple/sprite-front.png",
      "plane": "garment-main",
      "order": 0,
      "anchor": "canvas.origin",
      "pivot": [
        0,
        0
      ],
      "paletteRoles": [
        "garment.primary"
      ],
      "covers": [],
      "suppresses": [],
      "tags": [
        "asset.outfit-simple"
      ],
      "bounds": {
        "x": 0,
        "y": 0,
        "width": 96,
        "height": 96
      }
    },
    {
      "id": "sprite-left",
      "selector": {
        "profile": "sprite",
        "view": "left"
      },
      "source": "images/outfit-simple/sprite-left.png",
      "plane": "garment-main",
      "order": 0,
      "anchor": "canvas.origin",
      "pivot": [
        0,
        0
      ],
      "paletteRoles": [
        "garment.primary"
      ],
      "covers": [],
      "suppresses": [],
      "tags": [
        "asset.outfit-simple"
      ],
      "bounds": {
        "x": 0,
        "y": 0,
        "width": 96,
        "height": 96
      }
    },
    {
      "id": "sprite-right",
      "selector": {
        "profile": "sprite",
        "view": "right"
      },
      "source": "images/outfit-simple/sprite-right.png",
      "plane": "garment-main",
      "order": 0,
      "anchor": "canvas.origin",
      "pivot": [
        0,
        0
      ],
      "paletteRoles": [
        "garment.primary"
      ],
      "covers": [],
      "suppresses": [],
      "tags": [
        "asset.outfit-simple"
      ],
      "bounds": {
        "x": 0,
        "y": 0,
        "width": 96,
        "height": 96
      }
    }
  ],
  "fallbacks": [],
  "provenance": {
    "authors": [
      "Character Creator contributors"
    ],
    "license": "CC0-1.0",
    "source": null,
    "contentHash": "sha256-b652399b09588d75c39e4fdfbea72e343a73a47284c41cca6f55c7e6646126d2"
  }
}
